<?xml version="1.0" encoding="UTF-8"?>
<Settings xmlns:xsi="http://www.w3.org/2001/XMLSchema-instance" xsi:noNamespaceSchemaLocation="XML_Schema/SettingsSconti_XML_Schema.xsd">
    <MinimiSpesi>100</MinimiSpesi>
    <MinimiSpesiDa>
        <Valore>1000</Valore>
        <DataInizio>05-05-2026</DataInizio>
    </MinimiSpesiDa>
    <ReputazioneMin>100</ReputazioneMin>
    <MesiMin>6</MesiMin>
    <AnniMin>1</AnniMin>
    <CasaSconto>From Software</CasaSconto>
    <GenereSconto>FPS</GenereSconto>
</Settings>